{
  "timing": "authoring",
  "template": {
    "template_id": "diagnose-dns-resolver-misconfiguration",
    "template_hash": "sha256:2577cc8a611d0604d758c54edadf6d18c046b9a59821a42344584b63ee20304d"
  },
  "generator": {
    "implementation": "llm-generator@0.1.0",
    "llm": {
      "provider": "openai",
      "model": "gpt-5.4-2026-03-05",
      "prompt_id": "activity-generation",
      "prompt_version": "1",
      "generation_parameters": {
        "max_tokens": 32000,
        "reasoning_effort": "high"
      }
    }
  },
  "generated_at": "2026-09-23T05:10:10.283345Z",
  "outputs": [
    {
      "kind": "activity",
      "path": "activities/gen-diagnose-dns-resolver-misconfiguration-001.json",
      "definition_id": "gen-diagnose-dns-resolver-misconfiguration-001",
      "definition_hash": "sha256:83f15a1ee97339b9260593bc8ec069d3987a9cfea73a7f19f3bb5941213b7787"
    },
    {
      "kind": "environment",
      "path": "environments/gen-diagnose-dns-resolver-misconfiguration-001.json",
      "definition_id": "gen-diagnose-dns-resolver-misconfiguration-001.env",
      "definition_hash": "sha256:f4abd0f1cc34c9b5ed54c5dd10a05b051b14f68b316a2e0c46c5f8a557b7df5f"
    },
    {
      "kind": "reference_solution",
      "path": "activities/gen-diagnose-dns-resolver-misconfiguration-001.solution.json",
      "definition_id": "gen-diagnose-dns-resolver-misconfiguration-001.solution",
      "definition_hash": "sha256:8f5d94c727629663af40d208c8addfe4b674796fe5e7eb0dd295628aab1af9d5"
    }
  ],
  "validation": {
    "outcome": "passed",
    "steps": [
      {
        "step": "schema",
        "outcome": "passed",
        "lab": null
      },
      {
        "step": "adapter_references",
        "outcome": "passed",
        "lab": null
      },
      {
        "step": "checks_fail_in_broken_state",
        "outcome": "passed",
        "lab": {
          "image_digest": "sha256:7f08c4aff13ff61a35d30e30c5c1ea8396eac6ab4ce19fd02d5a4b3b5d0d09a2",
          "fixture_id": "dns.resolver_lab"
        }
      },
      {
        "step": "checks_pass_after_solution",
        "outcome": "passed",
        "lab": {
          "image_digest": "sha256:7f08c4aff13ff61a35d30e30c5c1ea8396eac6ab4ce19fd02d5a4b3b5d0d09a2",
          "fixture_id": "dns.resolver_lab"
        }
      }
    ]
  },
  "rejected_candidates": [
    {
      "attempt": 1,
      "failed_step": "adapter_references",
      "reason": "environments/gen-diagnose-dns-resolver-misconfiguration-001.json#/fixture: dns.resolver_lab params.service_name must be inside zone 'corp.internal'"
    }
  ]
}
